{
  "order": 67,
  "slug": "WHAT_THE_BIBLE_SAYS_ABOUT_ISLAM_PART_TWO",
  "title": "What the Bible Says About Islam - II",
  "summary": "The first part of this Bible study considered the name and identity of God in the Bible and Islam. This Bible study will concern itself with the topic of salvation in the Bible and Islam. What does it mean to be saved from a religious perspective? Both Christians and Muslims will agree that we are saved from something, and that something is sin, death and hell. Furthermore, this salvation also implies, on the most rudimentary level, that we will live in heaven with God Almighty forever. This is where the similarity between the two religions ends. From time immemorial, humans have realized the wretched condition of this world and looked to the throne of God in heaven for deliverance and salvation. “Now when they heard this, they were pricked in their heart, and said unto Peter and to the rest of the apostles, Men and brethren, what shall we do?” Act 2:37",
  "pdfLink": "/sermons/WHAT_THE_BIBLE_SAYS_ABOUT_ISLAM_PART_TWO.pdf",
  "image": "/sermons/WHAT_THE_BIBLE_SAYS_ABOUT_ISLAM_PART_TWO.png",
  "pages": "4",
  "date": null
}