{
  "order": 117,
  "slug": "THE_CRY_OF_THE_MAN_OF_MACEDONIA",
  "title": "The Cry of the Man of Macedonia",
  "summary": "“And a vision appeared to Paul in the night; There stood a man of Macedonia, and prayed him, saying, Come over into Macedonia, and help us” (Act 16:9). Let us remember that prior to this vision, the Apostle Paul appeared determined to travel to Asia but the Spirit of the Lord hindered him. “Now when they had gone throughout Phrygia and the region of Galatia, and were forbidden of the Holy Ghost to preach the word in Asia, After they were come to Mysia, they assayed to go into Bithynia: but the Spirit suffered them not” (Acts 16: 6,7). Why did Paul want to go to Asia and not Europe? Could it be that, as a devout Jew, he despised the polytheism and philosophical antagonism towards God that flourished in the West? Scripture does not tell us but let us read between the lines and draw some important spiritual lessons for our own exhortation today. Here was a great man of God, Paul, who was filled with the power of Jesus to save, heal and convert the entire world. No wonder the Lord carefully directed his every move “For God so loved the world, that he gave his only begotten Son, that whosoever believeth in him should not perish, but have everlasting life” (John 3:16).",
  "pdfLink": "/sermons/THE_CRY_OF_THE_MAN_OF_MACEDONIA.pdf",
  "image": "/sermons/THE_CRY_OF_THE_MAN_OF_MACEDONIA.jpg",
  "pages": "3",
  "date": null
}