{
  "order": 13,
  "slug": "MINISTERS_OF_THE_GOLDEN_LAMPSTAND",
  "title": "Ministers Of The Golden Lampstand",
  "summary": "The churches are branches that emerge from the body of our Lord Jesus Christ. There are six branches – the number of man – but, thankfully, Jesus perfects the church as the seventh branch in the middle (the shaft). Jesus declared, ‘I am the vine, ye are the branches: He that abideth in me, and I in him, the same bringeth forth much fruit: for without me ye can do nothing’ (John 15:5). It is this spiritual image, the menorah, which is the national symbol of Israel, and one of logos of the Apostolic church, which should serve as a powerful object lesson for all leaders and ministers in the body of Jesus Christ, the holy church. Let us begin with the first aspect of the candlestick – pure gold.",
  "pdfLink": "/sermons/MINISTERS_OF_THE_GOLDEN_LAMPSTAND.pdf",
  "image": "/sermons/MINISTERS_OF_THE_GOLDEN_LAMPSTAND.png",
  "pages": "3",
  "date": null
}