{
  "order": 17,
  "slug": "YEHOVAH_TSIDQENUW",
  "title": "Yehovah Tsidqenuw",
  "summary": "Imagine not only borrowing, but forever owning, the righteousness of God almighty himself! This is precisely what God offers us in baptism in Jesus name – a permanent donning of his body, his righteousness. It is common to the human condition to seek to model and mimic someone else’s behavior; those we consider to be worthy of emulation. Sadly, we try to imitate the speech, acts and even dress of so-called “trendsetters” or the contemporary “influencers”. This is perhaps why some wish to rebel against the universalization of culture today and desperately seek to be “original” or “authentic”. In so doing, humans can only reclaim their sinful and depraved identity in our first parents, Adam and Eve",
  "pdfLink": "/sermons/YEHOVAH_TSIDQENUW.pdf",
  "image": "/sermons/YEHOVAH_TSIDQENUW.png",
  "pages": "3",
  "date": null
}