{
  "order": 99,
  "slug": "ACCOUNTING_FOR_THE_LITTLE_THAT_GOD_GAVE_US",
  "title": "Accounting for the Little that God Gave us",
  "summary": "“He also that had received two talents came and said, Lord, thou deliveredst unto me two talents: behold, I have gained two other talents beside them. His lord said unto him, Well done, good and faithful servant; thou hast been faithful over a few things, I will make thee ruler over many things: enter thou into the joy of thy lord.”Mat 25:22-23 This message is for those who have been given very few talents by the Lord because there is the danger of thinking that the talents are so few and insignificant that the Lord will not require of them from you. This would be an egregious error. God does not accept that any of his blessings, however small, are chucked away or neglected. This is the very reason the Lord Jesus commanded the apostles to gather the fragments of bread after he miraculously fed the 5000. “When they were filled, he said unto his disciples, Gather up the fragments that remain, that nothing be lost. Therefore, they gathered them together, and filled twelve baskets with the fragments of the five barley loaves, which remained over and above unto them that had eaten” (John 6:12, 13). The fragments filled 12 baskets – the number of divine representation and authority. Even the fragments and crumbs of God have apostolic power. Hallelujah!",
  "pdfLink": "/sermons/ACCOUNTING_FOR_THE_LITTLE_THAT_GOD_GAVE_US.pdf",
  "image": "/sermons/ACCOUNTING_FOR_THE_LITTLE_THAT_GOD_GAVE_US.jpg",
  "pages": "3",
  "date": null
}