{
  "order": 27,
  "slug": "JESUS_THE_SCAPEGOAT_FOR_OUR_SINS",
  "title": "Jesus: The Scapegoat For Our Sins",
  "summary": "[Leviticus 16:8 And Aaron shall cast lots upon the two goats; one lot for the LORD, and the other lot for the scapegoat.] There were two goats of enormous significance for Israel during the Day of Atonement, Yom Kippur. The commandments concerning these goats pointed to the events surrounding the trial, judgement and death of our Lord Jesus during Passover. Hence, it is fitting that we study this prayerfully to commemorate the Lord’s sacrifice for us all. Now, the two goats had two purposes: the one was to be sacrificed for the Lord and the other was the scapegoat.",
  "pdfLink": "/sermons/JESUS_THE_SCAPEGOAT_FOR_OUR_SINS.pdf",
  "image": "/sermons/JESUS_THE_SCAPEGOAT_FOR_OUR_SINS.png",
  "pages": "4",
  "date": null
}