{
  "order": 84,
  "slug": "SHOES_ON_HOLY_GROUND",
  "title": "Shoes on Holy Ground",
  "summary": "“And he said, Draw not nigh hither: put off thy shoes from off thy feet, for the place whereon thou standest is holy ground.” Exodus 3:5 For forty years Moses had put on his shoes and decided where he would go. He had killed the Egyptian soldier and fled to Midian. Now, for the first time in his life, he was commanded to remove his shoes because he stood on holy ground. I don’t know where you all have been before coming here to Paris, but would you kindly allow me to ask you to come forward to this pulpit, this mountain of God, and remove your shoes for the duration of this message in the spirit of Moses? In doing so we will send the Lord Jesus the message that we respect his holiness and are ready to submit to his will. The desert was hot, and one cannot walk around on bare feet. In addition, the desert floor was creeping with dangerous creatures such as snakes and scorpions. Furthermore, Moses would be unable to tend to the sheep of his father-in-law, Jethro, without shoes. One becomes very vulnerable without shoes in such an inhospitable environment. Nevertheless, God demands the removal of shoes. In repentance we show God that we have no other defense other than God. There is no plan B. We remove our shoes before the holy God so he can give us power to tread on serpents and scorpions. “Behold, I give unto you power to tread on serpents and scorpions, and over all the power of the enemy: and nothing shall by any means hurt you” (Luke 10:19).",
  "pdfLink": "/sermons/SHOES_ON_HOLY_GROUND.pdf",
  "image": "/sermons/SHOES_ON_HOLY_GROUND.jpg",
  "pages": "3",
  "date": null
}