{
  "order": 5,
  "slug": "young-for-god",
  "date": null,
  "title": "Young for God",
  "subTitle": "",
  "summary": "There are countless challenges facing the young today. This book is written with a burden to help the young navigate through these challenges using the word of God. What advice would the apostles have given youth today in regards to the omnipresent internet and social media for instance? It is argued that Christian youth can still look to the likes of David and Daniel as excellent role models in negotiating the trails and temptations common to youth today.",
  "pdfLink": "/books/Young_for_God.pdf",
  "image": "/books/Young_for_God.png",
  "pages": "58"
}