{
  "order": 102,
  "slug": "JESUS_SAW_MATTHEW",
  "title": "Jesus saw Matthew",
  "summary": "“And as Jesus passed forth from thence, he saw a man, named Matthew, sitting at the receipt of custom: and he saith unto him, Follow me. And he arose, and followed him.” Matthew 9:9 Years later, the apostle Matthew records the time he met the Lord Jesus. He was a tax collector, a publican. Not only Jews, but every nation under the yoke of Rome, hated tax collectors.  James Strong defines a publican in this manner: “a tax gatherer, collector of taxes or tolls, one employed by a publican or farmer general in the collection of taxes. The tax collectors were as a class, detested not only by the Jews, but by other nations also, both on account of their employment and of the harshness, greed, and deception, with which they did their job”. Matthew means “gift of Jehovah”, but clearly, he was more like the “curse of Jehovah” for everyone who met him. He was obviously used to receiving hate, threats and abuse from Jews which he normally dished out to them. The Devil wants some people to expect everyone to hate them so they can continue in their own hatred of others. No one ever invited Matthew to their homes or affairs. To choose a job where you work for the arch enemy of your people and extort taxes from the poor, is to permanently separate oneself from the nation of Israel. But one day, one merciful day, he saw a man coming towards him. This man did not have any hatred toward Matthew, only profound love. His name was Jesus.",
  "pdfLink": "/sermons/JESUS_SAW_MATTHEW.pdf",
  "image": "/sermons/JESUS_SAW_MATTHEW.jpg",
  "pages": "3",
  "date": null
}