{
  "order": 3,
  "slug": "the-two-shall-become-one-flesh",
  "date": null,
  "title": "The Two Shall Become One Flesh",
  "subTitle": "",
  "summary": "This booklet explores the mystery of biblical marriage as a type of the relationship between Christ and His bride, the Church. The uniqueness of this relationship is witnessed in the creation of the woman, from the rib of the man. This corresponds to the bride of Christ, the Church, which was similarly purchased with blood and water issuing from the side of her husband, the Lord Jesus Christ. Paul's command for husbands to love their wives and wives to respect their husbands are twin pillars central to the success of a marriage.",
  "pdfLink": "/books/The_Two_Shall_Become_One_Flesh.pdf",
  "image": "/books/The_Two_Shall_Become_One_Flesh.png",
  "pages": "52"
}