{
  "order": 32,
  "slug": "MUSIC_THE_KING_OF_BABYLON_AND_WORSHIP",
  "title": "Music, the King of Babylon and Worship",
  "summary": "The King of Babylon, Nebuchadnezzar, clearly understood music to be a vital accompaniment to worship. The Cambridge Dictionary defines music as, ‘A pattern of sounds made by musical instruments, voices, or computers, or a combination of these, intended to give pleasure to people listening to it.’ I believe that God made all things for his pleasure. The same Dictionary defines pleasure as, ‘Enjoyment, happiness, or satisfaction, or something that gives this.’ The sounds of nature – the wind, rivers, birds, animals and man – were intended to produce sounds for God’s pleasure. This is why Satan is so desirous of controlling and monitoring the gift of music.",
  "pdfLink": "/sermons/MUSIC_THE_KING_OF_BABYLON_AND_WORSHIP.pdf",
  "image": "/sermons/MUSIC_THE_KING_OF_BABYLON_AND_WORSHIP.png",
  "pages": "13",
  "date": null
}