{
  "order": 110,
  "slug": "THE_CHRISTIANS_BEST_FRIEND",
  "title": "The Christian's Best Friend",
  "summary": "“When thou goest, it shall lead thee; when thou sleepest, it shall keep thee; and when thou awakest, it shall talk with thee.” Proverbs 6:22 Solomon was speaking about the commandments of the father and mother. It is clear that he was referring to the word of God. The Queen of Sheba travelled from the ends of the earth to hear the wisdom that God gave Solomon. All we need to do is open the pages of the Bible to enjoy this wisdom. So, what does Solomon say? He says there is a book that will lead you, keep you when you sleep, and talk with you when you awake. What an incredible book! Why don’t we all take out our Bibles, have a close look at it, and declare – “this is my best friend!” Is there a friend who can be so intimate as to keep us when we sleep? Yes, the word of God! “A man that hath friends must shew himself friendly: and there is a friend that sticketh closer than a brother” (Proverbs 18:24).",
  "pdfLink": "/sermons/THE_CHRISTIANS_BEST_FRIEND.pdf",
  "image": "/sermons/THE_CHRISTIANS_BEST_FRIEND.jpg",
  "pages": "4",
  "date": null
}