{
  "order": 91,
  "slug": "CRIPPLED_YET_EATING_AT_THE_KINGS_TABLE",
  "title": "Crippled yet Eating at the King’s Table",
  "summary": "“Thou therefore, and thy sons, and thy servants, shall till the land for him, and thou shalt bring in the fruits, that thy master's son may have food to eat: but Mephibosheth thy master's son shall eat bread alway at my table. Now Ziba had fifteen sons and twenty servants” 2 Samuel 9:10 Mephibosheth was the son of Jonathan, the son of King Saul. As a child, his nurse dropped him in the chaos that followed the death of Jonathan and Saul. “And Jonathan, Saul's son, had a son that was lame of his feet. He was five years old when the tidings came of Saul and Jonathan out of Jezreel, and his nurse took him up, and fled: and it came to pass, as she made haste to flee, that he fell, and became lame. And his name was Mephibosheth” (2Sam 4:4). Like Mephibosheth, we all have some scars, some pain or even trauma inflicted upon us. We have all been dropped, so to speak, in the chaos that is life. As I speak (or you read), perhaps the pain of some childhood incident may sadly be reignited. Firstly, be assured it is not your fault, just as it was not Mephibosheth’s fault that he was dropped by his nurse. Simultaneously, we cannot blame the nurse; she saved the life of Mephibosheth. Sometimes, as the Lord Jesus himself declared, disabilities have nothing to do with our actions.",
  "pdfLink": "/sermons/CRIPPLED_YET_EATING_AT_THE_KINGS_TABLE.pdf",
  "image": "/sermons/CRIPPLED_YET_EATING_AT_THE_KINGS_TABLE.jpg",
  "pages": "3",
  "date": null
}